review_stars,reveiw_buy_site,review_name,review_date,review_title,review_text
평점5,술마켓,9209****,22.03.25.,동생네 하나 줬는데 맛있다구 하네욯ㅎㅎ배송도 꼼꼼하고 빨라서 만족합니다 ㅎㅎ다른 것들도 하나씩 맛보려구요 !,"동생네 하나 줬는데 맛있다구 하네욯ㅎㅎ
배송도 꼼꼼하고 빨라서 만족합니다 ㅎㅎ
다른 것들도 하나씩 맛보려구요 !"
평점5,술마켓,jdk6****,22.03.24.,늘빠른배송 만족합니다.,늘빠른배송 만족합니다.
평점5,술마켓,melk****,22.03.24.,배송 빠르고 좋습니다,배송 빠르고 좋습니다
평점5,배혜정도가,equu****,22.03.24.,다먹고 또주문합니다,다먹고 또주문합니다
평점5,배혜정도가,dlrk****,22.03.23.,주변에서 맛있다고 하여 먹어보려고 구매했습니다. 평소에 탄산을 잘 못 먹어서 막걸리도 탄산이 진한건 잘 못 넘기겠더라구요. 목넘김이 부드럽다고 해서 구매했어요. 마셔보기도 전에 신,주변에서 맛있다고 하여 먹어보려고 구매했습니다. 평소에 탄산을 잘 못 먹어서 막걸리도 탄산이 진한건 잘 못 넘기겠더라구요. 목넘김이 부드럽다고 해서 구매했어요. 마셔보기도 전에 신랑이 맛있다며 다 먹어버려서 맛은 모르겠네요.
평점5,배혜정도가,mari****,22.03.23.,정말맛있어서 이번에 또 구매합니다. 10병넘는 대용량 할인해주셨으면 좋겠어요,정말맛있어서 이번에 또 구매합니다. 10병넘는 대용량 할인해주셨으면 좋겠어요
평점5,배혜정도가,cosm****,22.03.23.,벌써 2번째 구매입니다.입소문 만큼 막걸리 넘 맛있어요.,"벌써 2번째 구매입니다.
입소문 만큼 막걸리 넘 맛있어요."
평점5,술마켓,alph****,22.03.23.,탄산있는 막걸리중엔 제일 맛있어요~배혜정도가 우곡생주랑 호랑이랑 제일 좋아합니다!!,"탄산있는 막걸리중엔 제일 맛있어요~
배혜정도가 우곡생주랑 호랑이랑 제일 좋아합니다!!"
평점5,배혜정도가,lge1****,22.03.23.,"매형께 보내드렸더니, 매우 좋아하시네요.만족합니다.","매형께 보내드렸더니, 매우 좋아하시네요.
만족합니다."
평점5,배혜정도가,happ****,22.03.23.,배송 빨리 왔구요~ 맛있어요 ^^,배송 빨리 왔구요~ 맛있어요 ^^
평점5,술마켓,xabi****,22.03.22.,바로 하나 까고 사진 찍는 걸 깜빡해서 다시 찍으려니 6병 다마셔버렸네요...새로운 막걸리들이 너무 맛있었어요..,"바로 하나 까고 사진 찍는 걸 깜빡해서 다시 찍으려니 6병 다마셔버렸네요...
새로운 막걸리들이 너무 맛있었어요.."
평점5,배혜정도가,dbwm****,22.03.22.,"너무맛있네요.게다가 배송도 오전에 구매했더니 다음날왔어요,최고입니다.","너무맛있네요.
게다가 배송도 오전에 구매했더니 다음날왔어요,
최고입니다."
평점5,술마켓,lord****,22.03.22.,꼼꼼한 포장과 빠른배송 만족해요골고루 먹어보고 다시 주문하려구요,"꼼꼼한 포장과 빠른배송 만족해요
골고루 먹어보고 다시 주문하려구요"
평점5,술마켓,sky6****,22.03.22.,요즘막걸리에빠졌는데색다른느낌이라맛있어요~,"요즘막걸리에빠졌는데
색다른느낌이라맛있어요~"
평점5,술마켓,jina****,22.03.22.,지역 특산주를 인터넷으로 주문가능하니 좋네요,지역 특산주를 인터넷으로 주문가능하니 좋네요
평점5,배혜정도가,tien****,22.03.22.,맛있어요. 편하게 잘 구매했습니다,맛있어요. 편하게 잘 구매했습니다
평점5,배혜정도가,jksc****,22.03.22.,호랑이 막걸리 너무 맛있어요,호랑이 막걸리 너무 맛있어요
평점3,술마켓,dent****,22.03.22.,그냥 그래요 취향은 아닌걸로,그냥 그래요 취향은 아닌걸로
평점5,술마켓,mact****,22.03.22.,호막 최애 막걸리입니다.,호막 최애 막걸리입니다.
평점5,배혜정도가,dpse****,22.03.22.,좋지요 좋아요 좋아요,좋지요 좋아요 좋아요
평점5,술마켓,sjsm****,22.03.21.,가게에서 먹어보고 구매했어요 요구르트같은게 아쥬 맛나요,가게에서 먹어보고 구매했어요 요구르트같은게 아쥬 맛나요
평점4,배혜정도가,nake****,22.03.21.,막거리가 깔끔한 맛입니다!,막거리가 깔끔한 맛입니다!
평점5,술마켓,mo10****,22.03.20.,제가 좋아하는 막걸리중 하나에요 맛있습니다,제가 좋아하는 막걸리중 하나에요 맛있습니다
평점5,술마켓,7895****,22.03.20.,맛있어요 ㅎ다음번에 또 구매하려구요,"맛있어요 ㅎ
다음번에 또 구매하려구요"
평점5,배혜정도가,vers****,22.03.20.,맛도좋고 최고입니다~,맛도좋고 최고입니다~
평점4,배혜정도가,chan****,22.03.20.,느xxx 보다 상당히 달다고 생각합니다. 술 못 드시는분들께 달달한 막걸리로서 먹기 편하다고 생각합니다,느xxx 보다 상당히 달다고 생각합니다. 술 못 드시는분들께 달달한 막걸리로서 먹기 편하다고 생각합니다
평점5,배혜정도가,kiki****,22.03.19.,시중에는 잘보이지 않았는데..인터넷 으로 구입하니 좋아요. 막걸리 맛있어요,"시중에는 잘보이지 않았는데..인터넷 으로 구입하니
좋아요. 막걸리 맛있어요"
평점5,술마켓,hifm****,22.03.19.,많이 맛있습니다 다음에도 사고싶네요,많이 맛있습니다 다음에도 사고싶네요
평점5,배혜정도가,sgjw****,22.03.19.,어무니가 참 좋아하는 막걸리에요,어무니가 참 좋아하는 막걸리에요
평점5,술마켓,ldk1****,22.03.19.,호랑이막걸리는 늘 재구매죠,호랑이막걸리는 늘 재구매죠
평점5,술마켓,left****,22.03.18.,적당한 탄산감에..맛에...이거 먹다 다른 막걸리 먹으면..못먹겠어요..,적당한 탄산감에..맛에...이거 먹다 다른 막걸리 먹으면..못먹겠어요..
평점5,배혜정도가,hmtj****,22.03.18.,적당한 단맛에 깔끔하니 목 넘김이 부드러워요~^^,적당한 단맛에 깔끔하니 목 넘김이 부드러워요~^^
평점5,배혜정도가,misu****,22.03.18.,탄산이 시원하게 터지는 맛난 막걸이^^,탄산이 시원하게 터지는 맛난 막걸이^^
평점5,배혜정도가,ccom****,22.03.18.,아내가 맛잇다고해서 한박스 삽니다,아내가 맛잇다고해서 한박스 삽니다
평점5,술마켓,qkrd****,22.03.17.,처음 먹어보는 술인데 맛있네요~ 다만 제품에도 기재되어있는 부분인데 너무 과음하면 큰일날거 같은 느낌이에여 ㅎㅎ,처음 먹어보는 술인데 맛있네요~ 다만 제품에도 기재되어있는 부분인데 너무 과음하면 큰일날거 같은 느낌이에여 ㅎㅎ
평점3,배혜정도가,anak****,22.03.17.,배송에 아이스팩이 다 터져서 왔네요 신경좀 쓰세요,배송에 아이스팩이 다 터져서 왔네요 신경좀 쓰세요
평점4,배혜정도가,sona****,22.03.17.,막걸리 맛있습니다..기대이상,막걸리 맛있습니다..기대이상
평점5,술마켓,alxl****,22.03.17.,배송도 빠르고 맛있었어요,배송도 빠르고 맛있었어요
평점5,배혜정도가,draq****,22.03.17.,제일 좋아하는 막걸리,제일 좋아하는 막걸리
평점5,술마켓,chic****,22.03.16.,가벼운 탄산과 달콤함이 있는 막걸리에요. 지역별 주류를 인터넷으로 주문할수 있어 좋네요.,가벼운 탄산과 달콤함이 있는 막걸리에요. 지역별 주류를 인터넷으로 주문할수 있어 좋네요.
평점5,배혜정도가,lge1****,22.03.16.,"장모님께 보내드렸는데, 무척 좋아하시네요.","장모님께 보내드렸는데, 무척 좋아하시네요."
평점5,술마켓,hong****,22.03.16.,가게에서 먹고 맛있어서 주문했어요,가게에서 먹고 맛있어서 주문했어요
평점5,술마켓,rla9****,22.03.16.,맛있어요 다음에 또 주문할게요,맛있어요 다음에 또 주문할게요
평점5,배혜정도가,wjsw****,22.03.16.,느린마을 보다 맛남,느린마을 보다 맛남
평점5,술마켓,skys****,22.03.16.,좋은 제품 이에요.,좋은 제품 이에요.
평점5,배혜정도가,yooo****,22.03.15.,저번에 주문하고 또시켰습니다 막걸리 라벨 디자인도 마음에 드네요 ㅎㅎ,저번에 주문하고 또시켰습니다 막걸리 라벨 디자인도 마음에 드네요 ㅎㅎ
평점5,술마켓,haha****,22.03.15.,"맛있어요, 목넘김도 좋아요. 다음에 또 먹을예정입니다.","맛있어요, 목넘김도 좋아요. 다음에 또 먹을예정입니다."
평점4,배혜정도가,hami****,22.03.15.,막걸리 너무 부드럽네요맛있어요 종종 사먹어야겠어요막걸리 특유의 약냄세 같은거 안나서 너무 좋았어요,"막걸리 너무 부드럽네요
맛있어요 종종 사먹어야겠어요
막걸리 특유의 약냄세 같은거 안나서 너무 좋았어요"
평점5,술마켓,cona****,22.03.14.,올해 호랑이해라서 시켜본건데 가족들이 다 맛있다고 좋아했어요!!!,올해 호랑이해라서 시켜본건데 가족들이 다 맛있다고 좋아했어요!!!
평점5,배혜정도가,k990****,22.03.14.,마실때 부드럽고 맛있어여두번째 시켜서 먹지만 또시켜서 마실듯~~,"마실때 부드럽고 맛있어여
두번째 시켜서 먹지만 또시켜서 마실듯~~"
평점5,배혜정도가,mono****,22.03.13.,아침햇살 마시는것처럼 진하고 부드러워요 너무 맛있어요,아침햇살 마시는것처럼 진하고 부드러워요 너무 맛있어요
평점5,술마켓,say_****,22.03.12.,주류 중 하나가 살짝 새어왔어요맛은 정말 다 좋습니다 잘 마실게요 ?,"주류 중 하나가 살짝 새어왔어요
맛은 정말 다 좋습니다
잘 마실게요 ?"
평점5,술마켓,zlap****,22.03.12.,탄산이 적어 부드러워요. 달달한 맛이 과하지 않아서 좋았어요.,탄산이 적어 부드러워요. 달달한 맛이 과하지 않아서 좋았어요.
평점5,술마켓,noin****,22.03.12.,아직 마셔보지 않았지만 기대가 됩니다.,아직 마셔보지 않았지만 기대가 됩니다.
평점5,배혜정도가,wwww****,22.03.12.,굉장히 부드럽고 맛이 깔끔해 좋습니다,굉장히 부드럽고 맛이 깔끔해 좋습니다
평점5,배혜정도가,boyi****,22.03.12.,남편이 꼭 먹고싶다해서 샀는데 너무너무 좋아하네요저는 맛도 못보게합니다..맛있고 목넘김도 좋다고 하네요 ㅎㅎ,"남편이 꼭 먹고싶다해서 샀는데 너무너무 좋아하네요
저는 맛도 못보게합니다..
맛있고 목넘김도 좋다고 하네요 ㅎㅎ"
평점1,배혜정도가,shze****,22.03.11.,먹으면 배가 아픕니다.마트나 온라인으로 많이 막걸리 먹는편인데 이건 마실때마다 배가 아파서 6병 중 3병은 버렸네요다음날 배가 아픈게 아니라 먹고 잠시후 아파서 긴가민가 했어요그래,"먹으면 배가 아픕니다.
마트나 온라인으로 많이 막걸리 먹는편인데 이건 마실때마다 배가 아파서 6병 중 3병은 버렸네요

다음날 배가 아픈게 아니라 먹고 잠시후 아파서 긴가민가 했어요
그래서 마시는걸 멈추고 다른술 먹었더니 괜찮았더라구요

그래서 다음날 한번 작정하고 나머지를 마셔보니 바로 화장실 행

또 다음날 테스트로 다른술 마셨더니 안아프고...

자주 마시던걸 마셔야겠다는 생각 들었습니다."
평점4,배혜정도가,jook****,22.03.11.,달달하고 맛있어요 걸쭉하지많고 가벼운 목넘김,달달하고 맛있어요 걸쭉하지많고 가벼운 목넘김
평점5,배혜정도가,khi5****,22.03.11.,적당한 탄산감과 단맛이 좋네요 맛있어요,"적당한 탄산감과 단맛이 좋네요
맛있어요"
평점5,술마켓,2jjh****,22.03.11.,가족들끼리 다 맛있게 잘 마셨습니다!,가족들끼리 다 맛있게 잘 마셨습니다!
평점4,술마켓,wja0****,22.03.11.,포장도 꼼꼼하고 맛있어요,포장도 꼼꼼하고 맛있어요
평점5,배혜정도가,may0****,22.03.11.,소문듣고 구매했어요,소문듣고 구매했어요
평점3,배혜정도가,hsa0****,22.03.11.,자연의 단맛이라고 광고하고 스테비아첨가... 과장광고? 맛은괜춘,자연의 단맛이라고 광고하고 스테비아첨가... 과장광고? 맛은괜춘
평점5,술마켓,brig****,22.03.11.,편하게 주문할 수 있어 좋네요 배송 빠르고 포장 꼼꼼 안전하게 왔어요,편하게 주문할 수 있어 좋네요 배송 빠르고 포장 꼼꼼 안전하게 왔어요
평점5,배혜정도가,kore****,22.03.11.,역시 호랭호랭 막거리입니다.,역시 호랭호랭 막거리입니다.
평점5,술마켓,juni****,22.03.11.,대나무랑 비슷한 목넘김인데 .. 취향은 대나무가 승~!,대나무랑 비슷한 목넘김인데 .. 취향은 대나무가 승~!
평점5,배혜정도가,janu****,22.03.10.,달달하니 맛이 아주 좋습니다. ㅎ,달달하니 맛이 아주 좋습니다. ㅎ
평점5,술마켓,towa****,22.03.10.,맛있게 잘 먹겠습니,맛있게 잘 먹겠습니
평점5,술마켓,yoon****,22.03.09.,여러개 구매해서 지인들한테 선물했는데 다 좋아하네요 막걸리도 맛있어요,여러개 구매해서 지인들한테 선물했는데 다 좋아하네요 막걸리도 맛있어요
평점5,배혜정도가,eunn****,22.03.09.,지금까지 의 막걸리 중에서는 가장좋아요아주만족합니다,"지금까지 의 막걸리 중에서는 가장좋아요
아주만족합니다"
평점5,배혜정도가,suki****,22.03.09.,깔끔하네요~ 안터지고 배송도 잘왔어요,깔끔하네요~ 안터지고 배송도 잘왔어요
평점5,술마켓,chri****,22.03.09.,막입이라 잘 모르겠지만 잘 마셨어요,막입이라 잘 모르겠지만 잘 마셨어요
평점5,배혜정도가,love****,22.03.09.,상품 및 배송이 좋았습니다,상품 및 배송이 좋았습니다
평점5,배혜정도가,equu****,22.03.08.,無 아스타팜 이막걸리 먹다가 다른막걸리는 비교조차 할수없어요정말 맛있고요아침뒤끝이 깔끔 합니다일단 마셔보셔야 이느낌 이십니다배혜정도가 싸랑해요,"無 아스타팜 이막걸리 먹다가 다른막걸리는 비교조차 할수없어요
정말 맛있고요
아침뒤끝이 깔끔 합니다
일단 마셔보셔야 이느낌 이십니다
배혜정도가 싸랑해요"
평점5,배혜정도가,dest****,22.03.08.,깔끔한 맛이네요. 기분좋게 달고 청량감도 적당합니다.,깔끔한 맛이네요. 기분좋게 달고 청량감도 적당합니다.
평점5,술마켓,dudw****,22.03.08.,안전하고 꼼꼼한 배송 감사합니다. 하나씩 먹어보고 입에 맞는걸로 주문할거에요,안전하고 꼼꼼한 배송 감사합니다. 하나씩 먹어보고 입에 맞는걸로 주문할거에요
평점5,술마켓,puli****,22.03.08.,호랑이는 맛있는데 원숭이는저는 별로였어요,"호랑이는 맛있는데 원숭이는
저는 별로였어요"
평점5,배혜정도가,oliv****,22.03.07.,넘 맛있어요. ^^ 단맛이 살짝 있네요. 느린마을 막걸리에 탄산 들어간 느낌이에요.,"넘 맛있어요. ^^ 단맛이 살짝 있네요.
느린마을 막걸리에 탄산 들어간 느낌이에요."
평점5,술마켓,jjki****,22.03.07.,아빠 사드렸어요포장꼼꼼하고 여러가지 맛볼수있어서너무 좋네요,"아빠 사드렸어요
포장꼼꼼하고 여러가지 맛볼수있어서
너무 좋네요"
평점5,배혜정도가,zoot****,22.03.07.,추천받아서 먹어봤는데 맛있어요 재구매의사있습니다,추천받아서 먹어봤는데 맛있어요 재구매의사있습니다
평점5,술마켓,anna****,22.03.07.,제가 제일 좋아하는 막걸리에요!,제가 제일 좋아하는 막걸리에요!
평점5,술마켓,matt****,22.03.07.,선물용으로 구매하였습니다,선물용으로 구매하였습니다
평점5,술마켓,hoon****,22.03.07.,자주 먹는술 맛나고 좋아요,자주 먹는술 맛나고 좋아요
평점5,술마켓,1818****,22.03.07.,맛있어요. 배송도 빨리왔어요,맛있어요. 배송도 빨리왔어요
평점5,배혜정도가,agan****,22.03.06.,"올해 호랑이 해여서 끌려서 마셔보기 시작했는데, 중독되었어요 ㅎㅎ 너무 좋아요","올해 호랑이 해여서 끌려서 마셔보기 시작했는데, 중독되었어요 ㅎㅎ 너무 좋아요"
평점5,배혜정도가,luna****,22.03.06.,달달하니 맛있어요 ㅎㅎ 저렴하게 잘산거 같아요!,달달하니 맛있어요 ㅎㅎ 저렴하게 잘산거 같아요!
평점5,술마켓,2san****,22.03.06.,잘받았습니다 아직 먹기전이예요,잘받았습니다 아직 먹기전이예요
평점5,배혜정도가,magu****,22.03.06.,화학의 냄새가 없는 자연그대로,화학의 냄새가 없는 자연그대로
평점4,술마켓,mong****,22.03.06.,감사핮니다.또 이용할께요,감사핮니다.또 이용할께요
평점3,배혜정도가,kitt****,22.03.06.,목넘김이 아주 좋아요,목넘김이 아주 좋아요
평점5,배혜정도가,agan****,22.03.06.,너무 맛있어서 매번 이것만 시켜 마십니다. 탄산도 적어서 목 넘김이 너무 좋아요!,너무 맛있어서 매번 이것만 시켜 마십니다. 탄산도 적어서 목 넘김이 너무 좋아요!
평점5,술마켓,ajis****,22.03.06.,적당한 탄산에 적당한 달기 넘나 맛나요,적당한 탄산에 적당한 달기 넘나 맛나요
평점5,술마켓,woos****,22.03.05.,종류가 다양해서 골라 마시기 좋아요,종류가 다양해서 골라 마시기 좋아요
평점5,술마켓,wlsx****,22.03.05.,아직 시음전이라 기대하고 있습니다,아직 시음전이라 기대하고 있습니다
평점5,술마켓,fjqm****,22.03.05.,막걸리 게 Top 10 있습니다,막걸리 게 Top 10 있습니다
평점5,술마켓,rami****,22.03.05.,기대가 되는 막걸리에요,기대가 되는 막걸리에요
평점5,술마켓,line****,22.03.05.,맛있네요. 감사합니다.,맛있네요. 감사합니다.
평점5,술마켓,spir****,22.03.05.,너무너무너무 맛있습니다,너무너무너무 맛있습니다
평점5,술마켓,sams****,22.03.04.,"상품, 배송 모두 만족합니다~~","상품, 배송 모두 만족합니다~~"
평점5,술마켓,ghdw****,22.03.04.,완전 맛있어요 강추,완전 맛있어요 강추
평점5,배혜정도가,chiy****,22.03.03.,기분 나쁜 트름이 안 나오고 부드러운 단 맛이 좋아요?,기분 나쁜 트름이 안 나오고 부드러운 단 맛이 좋아요?
평점5,술마켓,shfw****,22.03.03.,배송도 빠르고 다양한 술을 한번에 받아봐서 좋았습니다~,배송도 빠르고 다양한 술을 한번에 받아봐서 좋았습니다~
평점5,술마켓,woru****,22.03.03.,와우 너무 맛있어용첫잔은 맑은잔 알쥬 꺄,"와우 너무 맛있어용
첫잔은 맑은잔 알쥬 꺄"
평점5,술마켓,jdj8****,22.03.03.,적절히 달고 균형있는 맛이 좋습니다.,적절히 달고 균형있는 맛이 좋습니다.
평점5,술마켓,hyew****,22.03.03.,존맛이었습니다 달달해요,존맛이었습니다 달달해요
평점5,술마켓,wind****,22.03.03.,적당히 달고 맛있어요~,적당히 달고 맛있어요~
평점5,배혜정도가,nhw0****,22.03.03.,안전하게 잘 배송되어 냉장고에 넣어뒀습니다.맛나게 잘 먹겠습니다.감사합니다.,"안전하게 잘 배송되어 냉장고에 넣어뒀습니다.
맛나게 잘 먹겠습니다.
감사합니다."
평점5,배혜정도가,kkkk****,22.03.03.,배송 빠르고 잘 받았습니다 감사합니다^^,배송 빠르고 잘 받았습니다 감사합니다^^
평점5,술마켓,dytp****,22.03.02.,하나씩 맛보면서 다음에 뭐 시킬지 고민하는 중입니다ㅋㅋ,하나씩 맛보면서 다음에 뭐 시킬지 고민하는 중입니다ㅋㅋ
평점5,술마켓,brow****,22.03.02.,목 넘김이 좋고 적당한 단맛이 좋아요,목 넘김이 좋고 적당한 단맛이 좋아요
평점5,배혜정도가,want****,22.03.01.,시원하면서도 깔끔한 맛이 일품입니다. 많이 마셔도 머리가 아프지 않아서 과음하게 된다는 점이 유일한 단점인... 라벨에 그려진 무심한 표정의 호랑이도 참 귀여워요!,시원하면서도 깔끔한 맛이 일품입니다. 많이 마셔도 머리가 아프지 않아서 과음하게 된다는 점이 유일한 단점인... 라벨에 그려진 무심한 표정의 호랑이도 참 귀여워요!
평점5,술마켓,want****,22.03.01.,주변 사람들이 불호 없이 모두 좋아하는 술이라 상비해두고 떨어질 때마다 주문하게 되네요. 기본에 충실하면서도 깔끔하고 부담이 없어서 자주 손이 갑니다.,주변 사람들이 불호 없이 모두 좋아하는 술이라 상비해두고 떨어질 때마다 주문하게 되네요. 기본에 충실하면서도 깔끔하고 부담이 없어서 자주 손이 갑니다.
평점5,배혜정도가,eh21****,22.03.01.,최고에요~~^^ 우리 식구 모두 좋아합니다^^,"최고에요~~^^
우리 식구 모두 좋아합니다^^"
평점5,술마켓,1022****,22.03.01.,맛있어여 부드럽습니다,맛있어여 부드럽습니다
평점5,배혜정도가,ybrd****,22.03.01.,맛있어요~!!!! 달달하니 넘맛나고 포장도 잘왔어요,맛있어요~!!!! 달달하니 넘맛나고 포장도 잘왔어요
평점5,배혜정도가,vnxl****,22.02.28.,"원래 막걸리 안좋아하고 막걸리 마실때 무조건 사이다 타먹어야하는데 이건 사이다없이도 마실수있을정도로 맛있어요! 그동안에 알밤막걸리, 땅콩막걸리 등등 달다는막걸리도 많이 접해봤지만","원래 막걸리 안좋아하고 막걸리 마실때 무조건 사이다 타먹어야하는데 이건 사이다없이도 마실수있을정도로 맛있어요! 그동안에 알밤막걸리, 땅콩막걸리 등등 달다는막걸리도 많이 접해봤지만 너무 저랑 안맞길래 저는 막걸리자체랑 안맞는구나 싶었어요..!! 근데 호랑이 막걸리를 딱 접하고나서 마셔보니 너무 깔끔하고 과하게 달지도않은데 그렇다고 단맛이 없는것도 아니에요 막걸리 그 특유의 비린맛?이라고 해야되나요 그맛이 싫어서 안먹는데 이건 그런맛이 일절없네요 지난번에 구매하고 추가로 주변에 선물할겸 겸사겸사 더 구매하였습니다:) 이번에 배송온거 아이스박스 뜯어보니 아이스팩이 뜯어져있어서 안이 완전 물바다더라고요ㅋㅋ 배송중에 터진건지 .. 그래도 막걸리가 안터진게 어디냐 생각하고 물 버리고 잘 먹었습니다:)"
평점5,배혜정도가,chul****,22.02.28.,생각보다 배송도빠르고 마트에서 먹다가 안팔아서 인터넷 찾아서 주문했는데 맛있게 잘먹었습니다뚜껑이 플라스틱이 아니 철로 밀봉이 잘되어있어서맛이 일정한거 같고 암튼 따봉이라,"생각보다 배송도빠르고 마트에서 먹다가 안팔아서
인터넷 찾아서 주문했는데 맛있게 잘먹었습니다
뚜껑이 플라스틱이 아니 철로 밀봉이 잘되어있어서
맛이 일정한거 같고 암튼 따봉이라 추천합니다
사진을 깜박잊고 못찍었네요"
평점5,술마켓,pupu****,22.02.28.,술을 자주 마시지 않아 아직 전부 먹어보지 못했는데 포장상태도 만족하고 해창막걸리만 먹어보았는데 저한테는 특별한 맛은 아니네용,술을 자주 마시지 않아 아직 전부 먹어보지 못했는데 포장상태도 만족하고 해창막걸리만 먹어보았는데 저한테는 특별한 맛은 아니네용
평점5,배혜정도가,dmsd****,22.02.28.,선물 받아보고 맛있어서찾아서 주문한ㄱㅓ였오요 살짝 다른 막걸리에 비해 단맛이 좀 있긴한데 너무 맛있어요,"선물 받아보고 맛있어서
찾아서 주문한ㄱㅓ였오요 살짝 다른 막걸리에 비해 단맛이 좀 있긴한데 너무 맛있어요"
평점5,술마켓,kkr7****,22.02.28.,무난해요. 술을잘못먹어도 한두잔좋아요,무난해요. 술을잘못먹어도 한두잔좋아요
평점5,배혜정도가,whit****,22.02.28.,목넘김이 좋고 맛있습니다,목넘김이 좋고 맛있습니다
평점5,술마켓,kks2****,22.02.28.,제 취향인듯 하넹 탄산,제 취향인듯 하넹 탄산
평점4,배혜정도가,gkfa****,22.02.28.,그냥술술들어가네요^^,그냥술술들어가네요^^
평점5,배혜정도가,toto****,22.02.28.,지평막걸리만 먹었는데 이막걸리도 넘맛있더라구요앞으로 쭉 이막걸리로 바꿔마셔야겠어요,"지평막걸리만 먹었는데 이막걸리도 넘맛있더라구요
앞으로 쭉 이막걸리로 바꿔마셔야겠어요"
평점5,술마켓,iami****,22.02.28.,재재구매입니다감사합니다,"재재구매입니다
감사합니다"
평점4,술마켓,gyle****,22.02.27.,친구들이랑 마시려고 샀어요!호랑이 막걸리 처음봐요~,"친구들이랑 마시려고 샀어요!
호랑이 막걸리 처음봐요~"
평점4,배혜정도가,pure****,22.02.27.,첫구매때 프리미엄 막걸리을 맛있게 마셔는데호랭이는 조금 부족한 맛이네요가격만 괜찮다면 프리미엄 마시고 싶어요,"첫구매때 프리미엄 막걸리을 맛있게 마셔는데
호랭이는 조금 부족한 맛이네요
가격만 괜찮다면 프리미엄 마시고 싶어요"
